{
	"system_name": "Package exercise README",
	"path": "",
	"target": 2,
	"type": 0,
	"comment_type": 2,
	"joomla_version": 6,
	"function_name": "aidocPackageReadme",
	"code": "This is an original [[[aidoc_package_label]]] learning fixture.\n",
	"hashendtarget": "",
	"to_line": "",
	"from_line": "",
	"hashtarget": "",
	"component": "0",
	"@dependencies": [
		{
			"key": "target",
			"value": "[[[aidoc_package_label]]]",
			"entity": "placeholder",
			"table": "#__componentbuilder_placeholder",
			"direction": "out"
		}
	]
}
